{
  "$schema": "../../../animation-package.schema.json",
  "version": 1,
  "animationId": "weapon.wooden-axe.attack.right",
  "displayName": "Wooden Axe right attack",
  "description": "Shared right attack animation extracted from Wooden Axe.",
  "animation": {
    "version": 2,
    "durationSeconds": 0.6666666666666666,
    "framesPerSecond": 12,
    "loop": false,
    "loopMode": "wrap",
    "layers": [
      {
        "layerId": "axe",
        "displayName": "Wooden axe",
        "assetId": "weapon.player.wooden-axe-tiles",
        "depthOffset": 0,
        "transform": {
          "offset": [
            0,
            0
          ],
          "scale": [
            0.62,
            0.62
          ],
          "rotationDeg": 0,
          "flipX": false,
          "flipY": false,
          "origin": [
            0.5,
            0.5
          ]
        },
        "blocks": [
          {
            "from": 0,
            "through": 0,
            "sourceFrame": 1,
            "transform": {
              "offset": [
                8,
                -22
              ],
              "scale": [
                1,
                1
              ],
              "rotationDeg": -65,
              "flipX": false,
              "flipY": false
            }
          },
          {
            "from": 1,
            "through": 1,
            "sourceFrame": 1,
            "transform": {
              "offset": [
                16,
                -14
              ],
              "scale": [
                1,
                1
              ],
              "rotationDeg": -45,
              "flipX": false,
              "flipY": false
            }
          },
          {
            "from": 2,
            "through": 2,
            "sourceFrame": 1,
            "transform": {
              "offset": [
                20,
                -10
              ],
              "scale": [
                1,
                1
              ],
              "rotationDeg": -20,
              "flipX": false,
              "flipY": false
            }
          },
          {
            "from": 3,
            "through": 3,
            "sourceFrame": 1,
            "transform": {
              "offset": [
                28,
                -10
              ],
              "scale": [
                1,
                1
              ],
              "rotationDeg": 10,
              "flipX": false,
              "flipY": false
            }
          },
          {
            "from": 4,
            "through": 4,
            "sourceFrame": 1,
            "transform": {
              "offset": [
                35,
                0
              ],
              "scale": [
                1,
                1
              ],
              "rotationDeg": 50,
              "flipX": false,
              "flipY": false
            }
          },
          {
            "from": 5,
            "through": 7,
            "sourceFrame": 1,
            "transform": {
              "offset": [
                35,
                20
              ],
              "scale": [
                1,
                1
              ],
              "rotationDeg": 80,
              "flipX": false,
              "flipY": false
            }
          }
        ]
      }
    ]
  }
}
