{
  "$schema": "../../../animation-package.schema.json",
  "version": 1,
  "animationId": "weapon.wooden-spear.attack.down",
  "displayName": "Wooden Spear down thrust",
  "description": "Wooden Spear down thrust with authored starter spear artwork.",
  "animation": {
    "version": 2,
    "durationSeconds": 0.4,
    "framesPerSecond": 20,
    "loop": false,
    "loopMode": "wrap",
    "layers": [
      {
        "layerId": "spear",
        "displayName": "Spear and thrust trail",
        "assetId": "weapon.player.starter-spears-tiles",
        "depthOffset": 0,
        "blocks": [
          {
            "from": 0,
            "through": 0,
            "sourceFrame": 0,
            "transform": {
              "offset": [
                0,
                -20
              ],
              "scale": [
                1,
                1
              ],
              "rotationDeg": 140,
              "flipX": false,
              "flipY": false
            }
          },
          {
            "from": 1,
            "through": 1,
            "sourceFrame": 0,
            "transform": {
              "offset": [
                0,
                0
              ],
              "scale": [
                1,
                1
              ],
              "rotationDeg": 140,
              "flipX": false,
              "flipY": false
            }
          },
          {
            "from": 2,
            "through": 2,
            "sourceFrame": 0,
            "transform": {
              "offset": [
                0,
                20
              ],
              "scale": [
                1,
                1
              ],
              "rotationDeg": 140,
              "flipX": false,
              "flipY": false
            }
          },
          {
            "from": 3,
            "through": 3,
            "sourceFrame": 0,
            "transform": {
              "offset": [
                0,
                40
              ],
              "scale": [
                1,
                1
              ],
              "rotationDeg": 140,
              "flipX": false,
              "flipY": false
            }
          },
          {
            "from": 4,
            "through": 6,
            "sourceFrame": 1,
            "transform": {
              "offset": [
                0,
                60
              ],
              "scale": [
                1,
                1
              ],
              "rotationDeg": 135,
              "flipX": false,
              "flipY": false
            }
          },
          {
            "from": 7,
            "through": 7,
            "sourceFrame": 0,
            "transform": {
              "offset": [
                0,
                40
              ],
              "scale": [
                1,
                1
              ],
              "rotationDeg": 140,
              "flipX": false,
              "flipY": false
            }
          }
        ],
        "transform": {
          "offset": [
            0,
            0
          ],
          "scale": [
            0.6,
            0.6
          ],
          "rotationDeg": 0,
          "flipX": false,
          "flipY": false,
          "origin": [
            0.5,
            0.5
          ]
        }
      }
    ]
  }
}
